### ISSUE TITLE
Jetson velocity error real robot

### ISSUE THREAD

**Issue by becketps** [UniversalRobots/Universal_Robots_ROS2_Driver#1859]
### Affected ROS2 Driver version(s)

Ros2 Humble APT Install on Jetson systems

### Used ROS distribution.

Humble

### Which combination of platform is the ROS driver running on.

Ubuntu Linux with standard kernel

### How is the UR ROS2 Driver installed.

From binary packets

### Which robot platform is the driver connected to.

Real robot

### Robot SW / URSim version(s)

Polyscope X 12.1

### How is the ROS driver used.

Through the robot teach pendant using External Control URCap

### Issue details

# Summary
*Short introduction to the issue and how it impact you and why*
Allways with the ai accelerator jetson when launching the driver and ros2 pub any pose the external controll says
Speed Limit velocity 35 required in joint 0 tó go from -168 to -1.61 within 0.002 seconds exeeding joint velocity limits. Ignoring commands. 

## Issue details
*Detailed description help us understand the problem. Code are welcome!*

I want to drive the robot with the AI Accelerator. The same program in ros2 which runs ion normal pc with the real robot does make the external controll speed limit error each time. The ros2 package errors are excluded because it runs well on normal pc systems. One of the drivers will calculate perhaps degrees where radians are necessary. Any time even when testing example move with standard apt ur driver package the error with different figures orcures. What is the porblem there?

## Steps to Reproduce
*Make simple example to reproduce the issue. Try to remove dependencies to other hardware and software components, if it is possible.*

## Expected Behavior
*What did you expect and why?*

Executing the trajectory like on normal pc systems in moveit or standard move group with standard driver.

<img width="559" height="309" alt="Image" src="https://github.com/user-attachments/assets/731830d0-9aa8-4da9-bf8d-3616a64ba994" />

### Relevant log output

```shell

```

### Accept Public visibility

- [x] I agree to make this context public

**Comment by urfeex** [comment]
This popup means that the external side (The jetson board) sends a step that would be too big of a motion to execute. Please check the commands that are sent to the robot for sanity. Without further information (how are trajectories generated? Could you provide an example trajectory? Is the control frequency of the controller manager steadily at 500 Hz?) there's only guesswork we can make here.

**Comment by becketps** [comment]
Ok no problem. It is defnetly not comming from my code. 

To find the error 
I launched the driver with scaled joint trajectory controller as it was written here in this section

https://docs.universal-robots.com/Universal_Robots_ROS2_Documentation/doc/ur_robot_driver/ur_robot_driver/doc/usage/startup.html


Then I enabled the polyscope X external control and did  send the robot this command. Then Even directly it got me the error no matter how much sec I place there. On the normal pc it does not behave like that. 

```
ros2 action send_goal /scaled_joint_trajectory_controller/follow_joint_trajectory \
  control_msgs/action/FollowJointTrajectory \
  "{
    trajectory: {
      joint_names: [ur15_shoulder_pan_joint, ur15_shoulder_lift_joint, ur15_elbow_joint, ur15_wrist_1_joint, ur15_wrist_2_joint, ur15_wrist_3_joint],
      points: [
        { positions: [0.0, -1.57, 0.0, -1.57, 0.0, 0.0], time_from_start: {sec: 8, nanosec: 0} }
      ]
    }
  }"
```

I am not sure why the jetson believes that he should go there in 500Hz,

I also tried it properly with the MoveIt which also works on the normal PC but not on the AI Accelerator. It complains about the high values also. 


Dear support: 

I am currently working with the scaled_joint_trajectory_controller from the ur_controllers package and have observed timing-related issues on an NVIDIA Jetson platform. Jetson did loose interpolated points in between what you see there with 500Hz! Parameters are even ignored on the Accelerator due to that mismatch. Only last point goes to the controller who thinks in 0.002sec it should be done.

I would like to ask whether there is any way to configure or tune the latency, buffering, or timing behavior of the Scaled Joint Trajectory Controller. Specifically, is it possible to adjust parameters related to:

command buffering / queueing
interpolation rate or execution frequency
communication or scheduling delays
or any other timing-related settings that could reduce sensitivity to CPU load

From my understanding, the controller performs interpolation on the ROS host and adapts execution based on robot speed scaling, which makes it sensitive to compute performance.

For reference, I am also using the Passthrough Trajectory Controller as a fallback, which behaves more robustly in my setup.

Any guidance on whether latency or timing behavior can be tuned, or if there are recommended best practices for constrained hardware (like Jetson), would be greatly appreciated.

I think the same errors will happen on force torque or velocies contoll loops.

**Comment by becketps** [comment]
Dear support: 

I am currently working with the scaled_joint_trajectory_controller from the ur_controllers package and have observed timing-related issues on an NVIDIA Jetson platform. Jetson did loose interpolated points in between what you see there with 500Hz!

I would like to ask whether there is any way to configure or tune the latency, buffering, or timing behavior of the Scaled Joint Trajectory Controller. Specifically, is it possible to adjust parameters related to:

command buffering / queueing
interpolation rate or execution frequency
communication or scheduling delays
or any other timing-related settings that could reduce sensitivity to CPU load

From my understanding, the controller performs interpolation on the ROS host and adapts execution based on robot speed scaling, which makes it sensitive to compute performance.

For reference, I am also using the Passthrough Trajectory Controller as a fallback, which behaves more robustly in my setup.

Any guidance on whether latency or timing behavior can be tuned, or if there are recommended best practices for constrained hardware (like Jetson), would be greatly appreciated.

I think the same errors will happen on force torque or velocies contoll loops.

**Comment by urfeex** [comment]
The behavior that you see should obviously not be the case. When using the SJTC, as you mentioned, interpolation is handled by the ROS PC which poses requirements both to the compute capabilities / scheduling performance on the PC and real-time communication between the pc and the robot. However, if any of these was the real issue, I would expect to see different symptoms. (Note: That's why I asked about the controller frequency earlier. On Humble the built-in diagnostic tools are not as sophisticated, but a `ros2 topic hz /joint_states` should give a rough estimate.)

Thank you for reducing it to a simple example, that does make it more understandable

Could you please post the output of the following two commands:

```
apt list | grep installed | grep ros-humble-joint-trajectory-controller
```
```
apt list | grep installed | grep ros-humble-ur-
```

Also, to fully debug this, please record a tcpdump, so we can see what data is actually being sent to the robot (Execute this command on the jetson shortly before you send the action and ctrl-c it once the action is done / the error popped up):

```
sudo tcpdump -n -i any tcp and dst host 192.168.56.101 and src port 50001 -w reverse_interface.pcap
```

**Comment by becketps** [comment]
I did this here on Jetson. 

lab@tegra-ubuntu:~/Desktop$ apt list | grep installed | grep ros-humble-joint-trajectory-controller

WARNING: apt does not have a stable CLI interface. Use with caution in scripts.

ros-humble-joint-trajectory-controller/jammy,now 2.53.1-1jammy.20260611.124056 arm64 [installed,automatic]


Here on ur-controllers

lab@tegra-ubuntu:~/Desktop$ apt list | grep installed | grep ros-humble-ur-

WARNING: apt does not have a stable CLI interface. Use with caution in scripts.

ros-humble-ur-client-library/jammy,now 2.13.0-1jammy.20260619.115509 arm64 [installed,automatic]
ros-humble-ur-controllers/jammy,now 2.13.2-1jammy.20260625.111812 arm64 [installed,automatic]
ros-humble-ur-dashboard-msgs/jammy,now 2.13.2-1jammy.20260625.111111 arm64 [installed,automatic]
ros-humble-ur-description/jammy,now 2.11.0-1jammy.20260613.004916 arm64 [installed,automatic]
ros-humble-ur-moveit-config/jammy,now 2.13.2-1jammy.20260625.111106 arm64 [installed]
ros-humble-ur-msgs/jammy,now 2.5.0-1jammy.20260605.134228 arm64 [installed,automatic]
ros-humble-ur-robot-driver/jammy,now 2.13.2-1jammy.20260625.112447 arm64 [installed]


Then when I am sending the command launching standard UR Driver then MoveIT and then making a small movement to plan


root@tegra-ubuntu:/workspaces/isaac_ros-dev# sudo tcpdump -n -i any tcp and dst host 192.168.0.168 and src port 50001 -w reverse_interface.pcap
tcpdump: data link type LINUX_SLL2
tcpdump: listening on any, link-type LINUX_SLL2 (Linux cooked v2), snapshot length 262144 bytes



There is no output of the last command you sended me.

**Comment by urfeex** [comment]
The packages are up-to-date and matching, that's good to know.

> There is no output of the last command you sended me.

The output is saved to a file called `reverse_interface.pcap`. Please upload that. And please use the example action as you've posted above. That way we know the exact input and can compare it with what we would expect.

**Comment by becketps** [comment]
I cannot upload here such files

**Comment by becketps** [comment]
[reverse_interface.zip](https://github.com/user-attachments/files/29890792/reverse_interface.zip)

Please let me know whats happening here.

**Comment by urfeex** [comment]
What is the matching error to the pcap file above? Which joint is complaining that it's trying to go from where to where?

**Comment by becketps** [comment]
it says always no matter what I am doing joint 0

Here Velocity 352.142 required in joint0 to go from -1.31 to -0.60 in 0.002 seconds

**Comment by urfeex** [comment]
OK. From the pcap file I can see that the first point that is sent to the robot is

```
    Joint 0 (raw int32): -607540 (double: -0.607540)
    Joint 1 (raw int32): -1533033 (double: -1.533033)
    Joint 2 (raw int32): -808942 (double: -0.808942)
    Joint 3 (raw int32): -72500 (double: -0.072500)
    Joint 4 (raw int32): -726114 (double: -0.726114)
    Joint 5 (raw int32): -116 (double: -0.000116)
    Control Type: 1
```

That doesn't quite add up. As I've asked you to start the `tcpdump` recording before sending the action goal, that would mean that the ROS controller is currently in holding position mode. The error says that the robot's joint0 is currently at position `-1.31...`. If that's the case, I would expect that the error would already popup **before** you send the action, since the (S)JTC will always send a target position to the robot.

Let's ramp things up a bit debug-wise. You can capture the complete relevant communication with the robot by

```
sudo tcpdump -i any -nn -w capture.pcap \
'tcp and ((dst host 192.168.178.103 and tcp src port 50001) or (src host 192.168.178.103 and (tcp src port 30001 or tcp src port 30004)))'
```
This will save the results to `capture.pcap`

What does the `/joint_states` topic echo before you send the goal? Does that make sense with where the robot is currently?

**Comment by becketps** [comment]
```
name:
- shoulder_pan_joint
- wrist_2_joint
- wrist_3_joint
- wrist_1_joint
- elbow_joint
- shoulder_lift_joint
position:
- -1.3089888731585901
- -1.5708053747760218
- -7.788287561538709e-07
- 1.6580566602894287
- -1.7453323602676392
- -1.4835310217789193
velocity:
- -6.932853466423694e-06
- -0.0011546369642019272
- -0.0007591667817905545
- 2.2250545953284018e-05
- 1.296247091886471e-06
- 4.9215435865335166e-05
effort:
- 0.9458991885185242
- -0.24381889402866364
- 0.5080108046531677
- -2.284956693649292
- 8.778903007507324
- 5.421326637268066
---
```




The robot joints in polyscope are

base -75 degree
shoulder -85 degree
elbow -100 degree
wrist1  95
wrist 2 -90
wrist3   0

**Comment by becketps** [comment]
[capture.zip](https://github.com/user-attachments/files/29896190/capture.zip)


Can you please tell me what we have to do here or what is wrong with my jetson?

**Comment by urfeex** [comment]
> [capture.zip](https://github.com/user-attachments/files/29896190/capture.zip)
> 
> Can you please tell me what we have to do here or what is wrong with my jetson?

Well, that's what I am trying to find out.

From what I can see so far, the issue you're observing, shouldn't happen. The `/joint_states` topic seems to show the correct joint values (`-1.3089888731585901` for joint0). The driver seems to be commanding that as a hold-position command until a certain point and then jumps to a new target right after:

```
Frame 7490: 92 bytes on wire (736 bits), 92 bytes captured (736 bits)
frame.time: Jul 10, 2026 15:28:21.239118000 UTC
Linux cooked capture v2
Internet Protocol Version 4, Src: 192.168.0.100, Dst: 192.168.0.168
Transmission Control Protocol, Src Port: 50001, Dst Port: 39414, Seq: 49345, Ack: 1, Len: 32
UR Reverse Interface Packet
    Timeout: 40
    Joint 0 (raw int32): -1309001 (double: -1.309001)
    Joint 1 (raw int32): -1483523 (double: -1.483523)
    Joint 2 (raw int32): -1745341 (double: -1.745341)
    Joint 3 (raw int32): 1658047 (double: 1.658047)
    Joint 4 (raw int32): -1570785 (double: -1.570785)
    Joint 5 (raw int32): 10 (double: 0.000010)
    Control Type: 1

Frame 7492: 92 bytes on wire (736 bits), 92 bytes captured (736 bits)
frame.time: Jul 10, 2026 17:28:21.241138000 CEST
Linux cooked capture v2
Internet Protocol Version 4, Src: 192.168.0.100, Dst: 192.168.0.168
Transmission Control Protocol, Src Port: 50001, Dst Port: 39414, Seq: 49377, Ack: 1, Len: 32
UR Reverse Interface Packet
    Timeout: 40
    Joint 0 (raw int32): -606233 (double: -0.606233)
    Joint 1 (raw int32): -1529948 (double: -1.529948)
    Joint 2 (raw int32): -808317 (double: -0.808317)
    Joint 3 (raw int32): -75005 (double: -0.075005)
    Joint 4 (raw int32): -727473 (double: -0.727473)
    Joint 5 (raw int32): 10 (double: 0.000010)
    Control Type: 1
```

It is correct and intentional that the script code reacts with the error popup. It's exactly made to prevent the robot from doing such sudden jumps. Now the question is: Why do those jumps happen? The target joint configuration isn't directly relatable to your overall target (`{ positions: [0.0, -1.57, 0.0, -1.57, 0.0, 0.0], time_from_start: {sec: 8, nanosec: 0} }`), thus my first theory would be that the JTC has a wrong joint state that it tries to interpolate from. (That's why I asked about the `/joint_states` topic. The JTC should read the same state interfaces as the joint state broadcaster reads and publishes on the `/joints_states` topic. However, since the states are correct, I suspect the error comes from inside the (S)JTC. Additionally, since the controller sends correct hold-position commands, it should be aware of the current joint configuration.

The controller itself samples the "point before trajectory" when executing a new trajectory, so potentially there's something wrong there.

For the sake of completeness: Could you please check whether the same issue occurs if you don't use the scaled version, but using the plain `joint_trajectory_controller`?

And, as a last data point we can collect: Could you please record a rosbag? (While running the same test command, ofc)

```
ros2 bag record -a --include-hidden-topics
```

**Comment by gavanderhoorn** [comment]
Off-topic, but: @urfeex: is the wireshark dissector available somewhere (I assume it's a wireshark dissector, or perhaps a Python script reading the `.pcap(ng)`)? I'd be interested.

**Comment by urfeex** [comment]
> Off-topic, but: [@urfeex](https://github.com/urfeex): is the wireshark dissector available somewhere (I assume it's a wireshark dissector, or perhaps a Python script reading the `.pcap(ng)`)? I'd be interested.

<details>
<summary>It's a wireshark dissector that I quickly whipped together without really knowing what I was doing. I don't really want to expose this too much, as this is just a tool for me that I don't want to have any maintenance overhead with.</summary>

```lua
-- Wireshark Lua dissector for Universal Robots Reverse Interface (32-byte format, big-endian, joint targets as doubles)

local ur_reverse_proto = Proto("URReverse", "Universal Robots Reverse Interface")

local f_timeout = ProtoField.uint32("urreverse.timeout", "Timeout", base.DEC)
local f_joint_raw = {}
for i = 1, 6 do
    f_joint_raw[i] = ProtoField.int32("urreverse.joint" .. i .. "_raw", "Joint " .. i-1 .. " (raw int32)", base.DEC)
end
local f_control_type = ProtoField.int32("urreverse.control_type", "Control Type", base.DEC)

local fields = {f_timeout, f_control_type}
for i = 1, 6 do
    table.insert(fields, f_joint_raw[i])
end
ur_reverse_proto.fields = fields

function ur_reverse_proto.dissector(buffer, pinfo, tree)
    pinfo.cols.protocol = "URReverse"
    local subtree = tree:add(ur_reverse_proto, buffer(), "UR Reverse Interface Packet")

    if buffer:len() < 32 then
        subtree:add_expert_info(PI_MALFORMED, PI_ERROR, "Packet too short (expected 32 bytes)")
        return
    end

    subtree:add(f_timeout, buffer(0, 4))
    for i = 1, 6 do
        local offset = 4 + (i - 1) * 4
        local raw_val = buffer(offset, 4):int()
        local joint_item = subtree:add(f_joint_raw[i], buffer(offset, 4))
        joint_item:append_text(string.format(" (double: %.6f)", raw_val / 1e6))
    end
    subtree:add(f_control_type, buffer(28, 4))

    if buffer:len() > 32 then
        subtree:add(buffer(32, buffer:len() - 32), "Extra Data")
    end
end

DissectorTable.get("tcp.port"):add(50001, ur_reverse_proto)
```
</details>

**Comment by becketps** [comment]
[scaled_ur_debug_bag.zip](https://github.com/user-attachments/files/29963459/scaled_ur_debug_bag.zip)

[scaled_capture.zip](https://github.com/user-attachments/files/29963465/scaled_capture.zip)

thats for the scaled one

with the normal one there is no error but also no execution on moveIT. There it executed but also moveit not

**Comment by urfeex** [comment]
> [scaled_ur_debug_bag.zip](https://github.com/user-attachments/files/29963459/scaled_ur_debug_bag.zip)
> 
> [scaled_capture.zip](https://github.com/user-attachments/files/29963465/scaled_capture.zip)
> 
> thats for the scaled one
> 
> with the normal one there is no error but also no execution on moveIT. There it executed but also moveit not

To use the non-scaled JTC in MoveIt, you would have to update your moveit_controllers yaml file. But the example command executed fine with the non-scaled JTC? That's at least interesting, thanks for trying that out. I'll look into the bag file to see whether I can find out what's going on.

**Comment by urfeex** [comment]
> [scaled_ur_debug_bag.zip](https://github.com/user-attachments/files/29963459/scaled_ur_debug_bag.zip)
> 
> [scaled_capture.zip](https://github.com/user-attachments/files/29963465/scaled_capture.zip)
> 
> thats for the scaled one
> 
> with the normal one there is no error but also no execution on moveIT. There it executed but also moveit not

That seems like the external control program was not running. The capture.pcap is empty and the rosbag shows that the robot didn't move:

<img width="1920" height="1200" alt="Image" src="https://github.com/user-attachments/assets/44d188ac-05d4-47b3-95f6-d37cb3e38608" />

**Comment by becketps** [comment]
[scaled_ur_debug_bag.zip](https://github.com/user-attachments/files/29966150/scaled_ur_debug_bag.zip)

[scaled_capture.zip](https://github.com/user-attachments/files/29966159/scaled_capture.zip)

There it was totally enabled.

**Comment by urfeex** [comment]
the `scaled_capture.pcap` is still empty. And the rosbag looks the same. Also (in both cases), the `desired` positions for joint0 look absolutely valid.

**Comment by becketps** [comment]
but why is then still the joint 0 error with the velocity there. I did nothing else there.

**Comment by urfeex** [comment]
please make sure that the tcpdump correctly recorded data. Without the debug information I'm afraid, there's not much I can do to help.

To verify that the tcpdump recorded data
- verify that the pcap file has a resonable size (not just a few bytes)
- you can open the pcap file using Wireshark, which will show you the packets. If the packet list is empty, no data has been recorded.

Since the pcap file doesn't contain any data at all, there seems to be something wrong with the tcpdump command. Did you use the command from above? I would need a rosbag and a tcpdump from the same run and that should be a run where the error occurred.

**Comment by urfeex** [comment]
But you did adapt the IP address to your local setup?

**Comment by becketps** [comment]
Here is the record. I hope that fits for you. It was my fault. I hope we find the error with that. 

[scaled_ur_debug_bag.zip](https://github.com/user-attachments/files/29973051/scaled_ur_debug_bag.zip)

[scaledcapture.zip](https://github.com/user-attachments/files/29973098/scaledcapture.zip)


I hope that fits.

**Comment by urfeex** [comment]
Thank you for providing the data. This is really giving me a headache.

With the timestamps from your bag and the capture I can match the start of the robot motion. The controller's output looks fine:

<img width="1920" height="1200" alt="Image" src="https://github.com/user-attachments/assets/f9d82300-d610-42e8-a00c-8e617b3214e5" />

The network command jumps from its hold-position value of `-1.308987` to `-0.606229` at `Jul 13, 2026 17:09:12.698115000 CEST`

**Note:** The plot shows the time in UTC, which is two hours behind of the local time zone that is shown in the package capture.
**Note 2:** The plot's time resolution is 50Hz due to the controller's status update frequency.

The value that is inside the controller's "desired" status isn't exactly the one that is commanded down to the robot. We sample the trajectory at `traj_time + period` to generate the target command:

https://github.com/UniversalRobots/Universal_Robots_ROS2_Driver/blob/bb6d99e865f4c878af2c8bc7cc4f0aa3ca3c0fdb/ur_controllers/src/scaled_joint_trajectory_controller.cpp#L189-L190

the desired state (where the robot is supposed to be now) is sampled at `traj_time` instead:
https://github.com/UniversalRobots/Universal_Robots_ROS2_Driver/blob/bb6d99e865f4c878af2c8bc7cc4f0aa3ca3c0fdb/ur_controllers/src/scaled_joint_trajectory_controller.cpp#L184-L185

Thus, given that the sampling itself is correct, it seems that the `update_period_` is off. This is generated from the `update_rate` parameter here: https://github.com/UniversalRobots/Universal_Robots_ROS2_Driver/blob/bb6d99e865f4c878af2c8bc7cc4f0aa3ca3c0fdb/ur_controllers/src/scaled_joint_trajectory_controller.cpp#L77. While the conversion itself could potentially be improved I don't see anything explaining that there would be something very odd coming out of that. Especially given that for the displacement that we see (jumping from `~-1.3` to `~-0.6` in a trajectory supposed to take 8 seconds to 0, I would assume it should be somewhere in the middle, which would be ~4 seconds which cannot be constructed by the line above.

The update_rate itself seems to be set correctly, since the controller_manager uses it, as well and commands are clearly sent down every 2ms.

Since Humble doesn't give us any deeper debugging, we would have to modify the code with debug output in order to find out what's happening. I'll setup an ARM system to see whether I can reproduce it there.

**Comment by urfeex** [comment]
Good news: I can reproduce this using a Raspberry Pi 3b running a ROS Humble installation. I will investigate this further.

**Comment by becketps** [comment]
thanks for your effort, It make me also headache like you. I am sure that it worked sime month before.

**Comment by urfeex** [comment]
My assumption proved to be correct. Apparently, the update rate isn't passed down from the controller manager and is read as 0. On amd64 (at least with gcc) the resulting update_period is 0, which is why it is working (though not the desired value). However, on arm64 it seems to be 4294967295 nanoseconds resulting in this ~4 sec jump that we observed.

As a temporary mitigation, you can explicitly pass the `update_rate` parameter with value `500` to the scaled JTC.

If you have your custom controller configuration, you can simply add it to the SJTC's list of parameters. If you launch the configuration from the installed package, you could do the dirty move and edit `/opt/ros/humble/share/ur_robot_driver/ur_robot_driver/config/ur_controllers.yaml` file (with sudo rights). Note: This is a very dirty thing to do and this will get overwritten with the next package update, so consider this a hotfix. A more proper solution would be to either have your own launch package with your own controller config or building the driver from source modifying the source file.

Nevertheless, the config file could look like this:
```
...
scaled_joint_trajectory_controller:
  ros__parameters:
    joints:
      - $(var tf_prefix)shoulder_pan_joint
      - $(var tf_prefix)shoulder_lift_joint
      - $(var tf_prefix)elbow_joint
      - $(var tf_prefix)wrist_1_joint
      - $(var tf_prefix)wrist_2_joint
      - $(var tf_prefix)wrist_3_joint
    command_interfaces:
      - position
    state_interfaces:
      - position
      - velocity
    state_publish_rate: 100.0
    action_monitor_rate: 20.0
    allow_partial_joints_goal: false
    constraints:
      stopped_velocity_tolerance: 0.2
      goal_time: 0.0
      $(var tf_prefix)shoulder_pan_joint: { trajectory: 0.2, goal: 0.1 }
      $(var tf_prefix)shoulder_lift_joint: { trajectory: 0.2, goal: 0.1 }
      $(var tf_prefix)elbow_joint: { trajectory: 0.2, goal: 0.1 }
      $(var tf_prefix)wrist_1_joint: { trajectory: 0.2, goal: 0.1 }
      $(var tf_prefix)wrist_2_joint: { trajectory: 0.2, goal: 0.1 }
      $(var tf_prefix)wrist_3_joint: { trajectory: 0.2, goal: 0.1 }
    speed_scaling_interface_name: $(var tf_prefix)speed_scaling/speed_scaling_factor
    update_rate: 500 
```

I'll work on a proper fix in the meantime.

**Comment by urfeex** [comment]
@becketps I've implemented a fix with a fallback in case of an unset controller update rate. I'll open a PR soon. If you like, you could test the fix by storing the library directly:

[libur_controllers.zip](https://github.com/user-attachments/files/30116815/libur_controllers.zip)

Place the `libur_controllers.so` in `/opt/ros/humble/lib` overwriting the one installed by the apt package.

**Note: The library is for ARM64 machines only!**

**Comment by becketps** [comment]
Dear Support I tested it with moveit but still have that problem there when using points which are far away. Did you fix that?

**Comment by urfeex** [comment]
what exactly do you mean by that?

Edit: I see with MoveIt I do indeed see some problems.

**Comment by becketps** [comment]
yes when you drag there the robot to another position and press plan and execute the error also pops up.

**Comment by urfeex** [comment]
For me the robot starts executing a bit and then runs into the issue. Is that the same for you?

**Comment by becketps** [comment]
yes sure. Sometimes when you do that far away also directly but mostly moving than error

**Comment by urfeex** [comment]
I've identified another issue coming from the refactoring done in the SJTC. I tested the following on my rasperry pi using

- The direct command mentioned above
- The `example_move.py` script
- The moveit example package from this repo

All three options didn't show any issues, both on an amd64 and an arm64 system.

@becketps would you like to tryout this version?
[libur_controllers.zip](https://github.com/user-attachments/files/30186704/libur_controllers.zip)

**Comment by becketps** [comment]
ok did you observe the error in joint 0 when moving the MoveIt manually and then plan and execute? So that scenario which you described priviously? With starting and stopping?

**Comment by urfeex** [comment]
Yes, I commanded a couple of target poses in RViz using the MoveIt plugin which all worked fine.

**Comment by becketps** [comment]
> I've identified another issue coming from the refactoring done in the SJTC. I tested the following on my rasperry pi using
> 
> * The direct command mentioned above
> * The `example_move.py` script
> * The moveit example package from this repo
> 
> All three options didn't show any issues, both on an amd64 and an arm64 system.
> 
> [@becketps](https://github.com/becketps) would you like to tryout this version? [libur_controllers.zip](https://github.com/user-attachments/files/30186704/libur_controllers.zip)


That is cool so far I tested it with this examples I don't know what you changed or if we have to fix it each time now on jetsons when something changes but this Examples also worked for me. I wanted to test now also the MTC MoveIt. That means the MoveIT Task constructor. My Goal is to combine that task constructor with moveit servo where visual servoing is possible. I saw they are using different velocity controllers. I also have to pay attention that everything even recource has to be very low to run on jetson systems. Switching on and of would be nice solution with the vision and planning pipeline in combination.
